{
  "species": "blob",
  "width": 6,
  "hatCol": 2,
  "poses": {
    "idle": [
      ["      ", " ({E}{E}) ", " (__) "],
      ["      ", " ({E}{E}) ", "(__)  "],
      ["      ", " (--) ", " (__) "]
    ],
    "walkRight": [
      ["      ", " ({E}{E})>", " /  \\ "],
      ["      ", " ({E}{E})>", " |  | "]
    ],
    "oops": [["      ", " ({E}{E})!", " (__) "]],
    "yay": [["      ", "\\({E}{E})/", " (__) "]],
    "sleep": [["      ", " (--) ", " (__) "]]
  },
  "lines": {
    "greeting": ["{name} blobs in."],
    "petted": ["{name} wobbles.", "Again, says {name}."]
  }
}
